{"schema_version":1,"project_id":"learning-demo","plan_id":"plan-demo","version":1,"suites":[{"suite_id":"suite-authors","objective":"activation","priority":1,"dependencies":[],"budget":null,"review_criteria":["Publishing result is visible"],"pieces":[{"piece_id":"piece-publish","audience_id":"authors","intention":"Show the publishing path","cta":"Create a lesson","message":"Publish a lesson for learners.","evidence_ids":["ev-publish"],"evidence_requirements":["Verified author publishing journey"],"structure":["Prerequisite","Steps","Published result","CTA"],"duration_seconds":90,"formats":["16:9"],"language":"en-US","channels":["help-center"],"order":1,"dependencies":[],"requirements":[],"review_criteria":["All required steps are shown"],"estimated_cost":null}]}],"pending":[],"out_of_scope":[]}
